<?xml version="1.0" encoding="UTF-8"?>
<!DOCTYPE root SYSTEM "ahp_conf.dtd">

<!--
	Document   : empty_ahp.xml
	Created on : 28 janvier 2013, 01:41
	Author     : Jean-Pierre PRUNARET
	Description:
		This document is the configuration file of the org.taeradan.ahp package, a new generic Java implementation of the AHP algorithm.
		For syntax information, just have a look at the ahp_conf.dtd file.
-->

<root>
	<name>Main goal</name>
	<prefmatrix>
		<row>
			<elt value="1"/>
			<elt value="1"/>
			<elt value="1"/>
		</row>
		<row>
			<elt value="1"/>
			<elt value="1"/>
			<elt value="1"/>
		</row>
		<row>
			<elt value="1"/>
			<elt value="1"/>
			<elt value="1"/>
		</row>
	</prefmatrix>
	<criteria id="C1">
		<name>My 1st criterion</name>
		<prefmatrix>
			<row>
				<elt value="1"/>
				<elt value="1/3"/>
				<elt value="1/3"/>
			</row>
			<row>
				<elt value="3"/>
				<elt value="1"/>
				<elt value="1"/>
			</row>
			<row>
				<elt value="3"/>
				<elt value="1"/>
				<elt value="1"/>
			</row>
		</prefmatrix>
		<indicator id="I11">
			<name>Indicator 11 : blah blah</name>
			<maximize/>
		</indicator>
		<indicator id="I12">
			<name>Indicator 12 : blah blah</name>
			<maximize/>
		</indicator>
		<indicator id="I13">
			<name>Indicator 13 : blah blah</name>
			<maximize/>
		</indicator>
	</criteria>
	<criteria id="C2">
		<name>My 2nd criterion</name>
		<prefmatrix>
			<row>
				<elt value="1"/>
				<elt value="1"/>
			</row>
			<row>
				<elt value="1"/>
				<elt value="1"/>
			</row>
		</prefmatrix>
		<indicator id="I21">
			<name>Indicator 21 : blah blah</name>
			<maximize/>
		</indicator>
		<indicator id="I22">
			<name>Indicator 21 : blah blah</name>
			<maximize/>
		</indicator>
	</criteria>
	<criteria id="C3">
		<name>My 3rd criterion</name>
		<prefmatrix>
			<row>
				<elt value="1"/>
				<elt value="1"/>
			</row>
			<row>
				<elt value="1"/>
				<elt value="1"/>
			</row>
		</prefmatrix>
		<indicator id="I31">
			<name>Indicator 31 : blah blah</name>
			<minimize/>
		</indicator>
		<indicator id="I32">
			<name>Indicator 32 : blah blah</name>
			<minimize/>
		</indicator>
	</criteria>
</root>
